{
  "$schema": "https://json-schema.org/draft/2020-12/schema",
  "title": "verbit 配置",
  "type": "object",
  "additionalProperties": false,
  "required": ["vault_root"],
  "properties": {
    "check_updates": {
      "type": "boolean",
      "default": false,
      "description": "启动时及每24小时查询GitHub发布版本，默认关闭。不上传录音、笔记、配置或凭据，不自动下载或安装；私有仓库请用浏览器访问发布页。"
    },
    "vault_root": {"type": "string", "minLength": 3, "description": "现存的 Windows 绝对目录；普通笔记文件夹或 Obsidian 库。"},
    "vault_id": {"type": "string", "default": "", "description": "Obsidian 库 ID 或库名；空值按库名打开。"},
    "vault_name": {"type": "string", "default": "", "description": "兼容旧配置的库名；优先级低于 vault_id。"},
    "meeting_folder": {"type": "string", "default": "会议记录", "minLength": 1, "description": "vault_root 内的相对目录，禁止路径穿越和 Windows 非法名称。"},
    "quick_note_folder": {"type": "string", "default": "速记", "minLength": 1, "description": "vault_root 内的速记相对目录；每天一篇 Markdown，图片放相邻图片目录。禁止路径穿越和 Windows 非法名称。"},
    "mic_device_id": {"type": "string", "default": "", "description": "空值跟随系统默认麦克风，包括录制中切换；非空固定该 Windows 设备 ID。"},
    "system_device_id": {"type": "string", "default": "", "description": "非空固定该输出设备，优先于 system_capture_mode；空值由 system_capture_mode 决定。"},
    "system_capture_mode": {"type": "string", "default": "all_active", "enum": ["all_active", "default"], "description": "all_active 收录所有活动输出端点，覆盖应用分流与默认设备切换；default 只跟随 Windows 默认播放设备。system_device_id 非空时固定该设备。新启用设备仍需初始化；受保护或独占音频可能不可录。"},
    "recording_protection_seconds": {"type": "integer", "default": 5, "minimum": 0, "maximum": 300, "description": "误触保护秒数；结束时有效录音时长不足此值则清理本场临时录音，不生成 MP3/Markdown、不转录。暂停麦克风仍计时；旧版整场暂停资料兼容原规则；等于此值保留，0关闭。仅对新会议生效。"},
    "recording_segment_seconds": {"type": "integer", "default": 300, "minimum": 10, "maximum": 600, "description": "原设备格式无损 WAV 分段时长，单位秒；达到安全字节边界会提前切分。保持同一会议时间轴，段仅为处理中间文件，成功后清理。"},
    "mp3_bitrate_kbps": {"type": "integer", "default": 192, "minimum": 128, "maximum": 320, "enum": [128, 192, 256, 320], "description": "新会议结束后先导出 MP3 的固定码率，单位 kbps；默认192。导出不依赖模型，首次转写仍使用无损原轨；成品与转写完整校验后才清理临时文件，失败保留恢复资料；旧录音不转换。"},
    "asr_context": {"type": "string", "default": "", "maxLength": 2000, "description": "人名、术语等转写提示；不是会议正文或指令。"},
    "asr_terms": {"type": "string", "default": "", "maxLength": 1000, "description": "已知姓名、产品名和术语，逗号、分号或换行分隔；最多64项、每项64字符，与asr_context合计最多2000字符。随新会议冻结，不保证必然识别正确。"},
    "speaker_anchor_mode": {"type": "string", "default": "legacy", "enum": ["legacy", "clean"], "description": "legacy保持旧声纹锚点；clean从讲话中扣除同轨异人重叠区，使用最长1.5至6秒干净区间。候选需真实身份标注验收，不固定人数、不放宽聚类阈值。"},
    "asr_segmentation": {"type": "string", "default": "speaker", "enum": ["speaker", "speech"], "description": "speaker按说话人分段；speech按连续讲话合并后在静音处切分，独立于人物编号。多人段保留人物时间范围，不声称逐字归属。候选默认关闭，随新会议冻结。"},
    "asr_denoise": {"type": "string", "default": "light", "enum": ["light", "off"], "description": "仅对转写片段去除低频轰鸣；不改变保留的合并录音。light轻量处理，off关闭。"},
    "asr_echo_filter": {"type": "boolean", "default": true, "description": "对转录中有高置信波形证据、延迟一致且正文相同的麦克风回声副本去重；不修改保留的会议录音，不等于声学回声消除。每场冻结，false关闭。"},
    "hotkey": {"type": "string", "default": "Ctrl+Alt+L", "pattern": "^(?:(?:Ctrl|Alt|Shift|Win)\\+)+(?:[A-Z]|F(?:[1-9]|1[0-9]|2[0-4])|Space)$"},
    "quick_note_hotkey": {"type": "string", "default": "Ctrl+Alt+J", "pattern": "^(?:(?:Ctrl|Alt|Shift|Win)\\+)+(?:[A-Z]|F(?:[1-9]|1[0-9]|2[0-4])|Space)$", "description": "全局显示或收起速记便签；与录音、暂停、标记快捷键各不相同。"},
    "pause_hotkey": {"type": "string", "default": "Alt+Space", "pattern": "^(?:(?:Ctrl|Alt|Shift|Win)\\+)+(?:[A-Z]|F(?:[1-9]|1[0-9]|2[0-4])|Space)$", "description": "仅录音期间注册；按一次暂停麦克风，再按一次恢复。与浮窗麦克风按钮共用状态，电脑声音持续录制，会议计时不中断。保留原配置字段与自定义组合。"},
    "bookmark_hotkey": {"type": "string", "default": "Ctrl+Alt+K", "pattern": "^(?:(?:Ctrl|Alt|Shift|Win)\\+)+(?:[A-Z]|F(?:[1-9]|1[0-9]|2[0-4])|Space)$", "description": "录音时标记会议时间，与开始/结束和暂停快捷键不同。"},
    "silence_warning_seconds": {"type": "integer", "default": 60, "minimum": 0, "maximum": 3600, "description": "两路持续无明显输入时提醒一次；0关闭。暂停麦克风时仅检查电脑声音，有声恢复后重新计时。"},
    "open_in_obsidian": {"type": "boolean", "default": true, "description": "true 使用 Obsidian；false 只保存普通 Markdown，不自动打开应用。旧配置缺省 true。"},
    "show_processing_window": {"type": "boolean", "default": true, "description": "结束后用原有 186×68 浮窗显示后台阶段或真实片段进度；可收起。false 仍可通过托盘查看状态。"},
    "animation_mode": {"type": "string", "enum": ["auto", "on", "off"], "default": "auto", "description": "auto 跟随 Windows 客户区动画及高对比设置；on 仅为 verbit 开启动效；off 关闭非必要动效。均不更改 Windows 设置，不影响真实输入和进度。"},
    "notify_device_changes": {"type": "boolean", "default": true, "description": "提醒设备变化；关闭只影响提示，不关闭自动跟随/所有活动输出捕获。固定设备 ID 不随默认设备变化。不把安静当作故障。"},
    "auto_open_completed_note": {"type": "boolean", "default": true, "description": "仅在 open_in_obsidian 为 true 且当前没有录音时，自动打开刚完成的笔记；录音中完成或启动时找回的成品由托盘手动打开。"},
    "transcription_mode": {"type": "string", "enum": ["local", "api"], "default": "local", "description": "local默认使用已安装的Qwen3-ASR-1.7B，仅在本机推理；FireRed和完整Community-1仍为独立评估候选，不能通过api_model切换。api需手动选择并配置服务，会上传转写音频。在线Omni聊天模型不能仅改模型名代替/audio/transcriptions接口。"},
    "api_base_url": {"type": "string", "default": "", "description": "API 模式必填完整 HTTP(S) 前缀，如 https://provider.example/v1；末尾追加 /audio/transcriptions。"},
    "api_model": {"type": "string", "default": "", "description": "API 模式必填服务支持的音频转写模型名。"},
    "api_key_env": {"type": "string", "default": "TINGJI_API_KEY", "pattern": "^[A-Za-z_][A-Za-z0-9_]*$", "description": "读取 API 密钥的环境变量名，不是密钥值。"},
    "api_timeout_seconds": {"type": "integer", "default": 120, "minimum": 10, "maximum": 600}
  }
}
