{
  "vault_root": "D:\\Notes\\MyVault",
  "vault_id": "",
  "check_updates": false,
  "meeting_folder": "会议记录",
  "quick_note_folder": "速记",
  "mic_device_id": "",
  "system_device_id": "",
  "system_capture_mode": "all_active",
  "recording_protection_seconds": 5,
  "recording_segment_seconds": 300,
  "mp3_bitrate_kbps": 192,
  "asr_context": "",
  "asr_terms": "",
  "speaker_anchor_mode": "legacy",
  "asr_segmentation": "speaker",
  "asr_denoise": "light",
  "asr_echo_filter": true,
  "hotkey": "Ctrl+Alt+L",
  "quick_note_hotkey": "Ctrl+Alt+J",
  "pause_hotkey": "Alt+Space",
  "bookmark_hotkey": "Ctrl+Alt+K",
  "silence_warning_seconds": 60,
  "open_in_obsidian": false,
  "show_processing_window": true,
  "animation_mode": "auto",
  "notify_device_changes": true,
  "auto_open_completed_note": true,
  "transcription_mode": "local",
  "api_base_url": "",
  "api_model": "",
  "api_key_env": "TINGJI_API_KEY",
  "api_timeout_seconds": 120
}
